uid,name,description,constituentDocUrl,homepage,headName,headPost,unitOfId,unitOfName,subUnitOfId,subUnitOfName,CATUTTC,addressAdminUnitL1,addressAdminUnitL2,addressAdminUnitL3,addressAdminUnitL4,addressPostName,addressThoroughfare,addressLocatorDesignator,addressLocatorName,addressPostCode,contactPointName,contactPointEmail,contactPointTelephone,openingHours,availabilityRestriction
107.1.22,"Відділ з питань державної реєстрації юридичних осіб, фізичних осіб-підприємців",Забезпечення реалізації державної політики у сфері державної реєстрації юридичних осіб та фізичних осіб підприємців.,https://media-stg.kyivcity.gov.ua/kyivcity/sites/16/docs/Rosp159.pdf,https://svyat.kyivcity.gov.ua/administratsiia/struktura/aparat-raionnoi-v-misti-kyievi-derzhavnoi-administratsii/viddil-z-pytan-derzhavnoi-reiestratsii-iurydychnykh-osib-fizychnykh-osib-pidpryiemtsiv,Малиновська Інна Василівна,Начальник відділу-державний реєстратор,37395418,Святошинська районна в місті Києві державна адміністрація,107.1,Апарат Святошинської районної в місті Києві державної адміністрації,UA80000000000093317,Україна,місто Київ,null,null,Київ,просп. Берестейський,97,null,03115,Відділ організації діловодства,doc.srda@kyivcity.gov.ua,+380444243006,"Пн-Чт 08:00-17:00, Пт 08:00-15:45",Перерва на обід: 12:00-12:45
107.1.19,Відділ з питань майна комунальної власності,"Здійснення в межах своїх повноважень функцій щодо управління майном, що належить до комунальної власності територіальної громади м. Києва та передано до сфери управління Святошинської районної в місті Києві державної адміністрації.",https://media-stg.kyivcity.gov.ua/kyivcity/sites/16/docs/Rosp175_20.pdf,https://svyat.kyivcity.gov.ua/administratsiia/struktura/aparat-raionnoi-v-misti-kyievi-derzhavnoi-administratsii/viddil-z-pytan-maina-komunalnoi-vlasnosti,Кульга Олександр Олександрович,В. о. Начальника відділу,37395418,Святошинська районна в місті Києві державна адміністрація,107.1,Апарат Святошинської районної в місті Києві державної адміністрації,UA80000000000093317,Україна,місто Київ,null,null,Київ,просп. Берестейський,97,null,03115,Відділ організації діловодства,doc.srda@kyivcity.gov.ua,+380444243006,"Пн-Чт 08:00-17:00, Пт 08:00-15:45",Перерва на обід: 12:00-12:45
107.1.9,Відділ контролю,Здійснення контролю документообігу органів державної влади.,https://media-stg.kyivcity.gov.ua/kyivcity/sites/16/docs/Rosp185.pdf,https://svyat.kyivcity.gov.ua/administratsiia/struktura/aparat-raionnoi-v-misti-kyievi-derzhavnoi-administratsii/viddil-kontroliu,Керезвас Лариса Аркадіївна,Начальник відділу,37395418,Святошинська районна в місті Києві державна адміністрація,107.1,Апарат Святошинської районної в місті Києві державної адміністрації,UA80000000000093317,Україна,місто Київ,null,null,Київ,просп. Берестейський,97,null,03115,Відділ організації діловодства,doc.srda@kyivcity.gov.ua,+380444243006,"Пн-Чт 08:00-17:00, Пт 08:00-15:45",Перерва на обід: 12:00-12:45
107.1.20,Відділ з питань внутрішньої політики та зв'язків з громадськістю,"Проведення аналізу і прогнозування суспільно-політичних процесів, що відбуваються в районі.",https://media-stg.kyivcity.gov.ua/kyivcity/sites/16/docs/Rosp195.pdf,https://svyat.kyivcity.gov.ua/administratsiia/struktura/aparat-raionnoi-v-misti-kyievi-derzhavnoi-administratsii/viddil-z-pytan-vnutrishnoi-polityky-ta-zviazkiv-z-hromadskistiu,Яковенко Людмила Іванівна,Начальник відділу,37395418,Святошинська районна в місті Києві державна адміністрація,107.1,Апарат Святошинської районної в місті Києві державної адміністрації,UA80000000000093317,Україна,місто Київ,null,null,Київ,просп. Берестейський,97,null,03115,Відділ організації діловодства,doc.srda@kyivcity.gov.ua,+380444243006,"Пн-Чт 08:00-17:00, Пт 08:00-15:45",Перерва на обід: 12:00-12:45
107.1.6,Відділ бухгалтерського обліку та звітності,"Основними завданнями відділу є забезпечення реалізації державної політики у сфері планування та виконання бюджету міста Києва в частині бюджетних програм та міжбюджетних трансфертів головного розпорядника коштів Святошинського району міста Києва, організації та ведення бухгалтерського обліку фінансово-господарської діяльності адміністрації, складання фінансової і бюджетної звітності.",https://media-stg.kyivcity.gov.ua/kyivcity/sites/16/docs/Rosp215.pdf,https://svyat.kyivcity.gov.ua/administratsiia/struktura/aparat-raionnoi-v-misti-kyievi-derzhavnoi-administratsii/viddil-bukhhalterskoho-obliku-ta-zvitnosti,null,Начальник відділу - головний бухгалтер,37395418,Святошинська районна в місті Києві державна адміністрація,107.1,Апарат Святошинської районної в місті Києві державної адміністрації,UA80000000000093317,Україна,місто Київ,null,null,Київ,просп. Берестейський,97,null,03115,Відділ організації діловодства,doc.srda@kyivcity.gov.ua,+380444243006,"Пн-Чт 08:00-17:00, Пт 08:00-15:45",Перерва на обід: 12:00-12:45
107.1.21,Сектор з питань приватизації житлового фонду,"Забезпечення реалізації державної політики у сфері приватизації житла, організація проведення приватизації державного житлового фонду та оформлення права власності на житло.",https://media-stg.kyivcity.gov.ua/kyivcity/sites/16/docs/Rosp255_20_1.pdf,https://svyat.kyivcity.gov.ua/administratsiia/struktura/aparat-raionnoi-v-misti-kyievi-derzhavnoi-administratsii/sektor-z-pytan-pryvatyzatsii-zhytlovoho-fondu,Полухіна Ірина Миколаївна,Завідувач сектору,37395418,Святошинська районна в місті Києві державна адміністрація,107.1,Апарат Святошинської районної в місті Києві державної адміністрації,UA80000000000093317,Україна,місто Київ,null,null,Київ,просп. Берестейський,97,null,03115,Відділ організації діловодства,doc.srda@kyivcity.gov.ua,+380444243006,"Пн-Чт 08:00-17:00, Пт 08:00-15:45",Перерва на обід: 12:00-12:45
107.1.18,"Відділ торгівлі, споживчого ринку та підприємництва","Забезпечення реалізації державної політики, спрямованої на розвиток підприємств торгівлі, ресторанного господарства, ринкової мережі, а також побутового обслуговування населення на території Святошинського району міста Києва; забезпечення реалізації державної політики з питань розвитку підприємництва, державної регуляторної політики.",https://media-stg.kyivcity.gov.ua/kyivcity/sites/16/docs/Rosp307_18.pdf,https://svyat.kyivcity.gov.ua/administratsiia/struktura/aparat-raionnoi-v-misti-kyievi-derzhavnoi-administratsii/viddil-torhivli-spozhyvchoho-rynku-ta-pidpryiemnytstva,Бєлоусова Алла Володимирівна,Начальник відділу,37395418,Святошинська районна в місті Києві державна адміністрація,107.1,Апарат Святошинської районної в місті Києві державної адміністрації,UA80000000000093317,Україна,місто Київ,null,null,Київ,просп. Берестейський,97,null,03115,Бєлоусова Алла Володимирівна,alla.belousova@kyivcity.gov.ua,+380444243215,"Пн-Чт 08:00-17:00, Пт 08:00-15:45",Перерва на обід: 12:00-12:45
107.1.4,"Відділ оборонної роботи, мобілізаційної підготовки та мобілізації",Основним завдання відділу є організація заходів з мобілізаційної підготовки та мобілізації і контроль за їх здійсненням.,https://media-stg.kyivcity.gov.ua/kyivcity/sites/16/docs/Rosp520_20.pdf,https://svyat.kyivcity.gov.ua/administratsiia/struktura/aparat-raionnoi-v-misti-kyievi-derzhavnoi-administratsii/sektor-z-pytan-mobilizatsiinoi-roboty,Беседа Сергій Анатолійович,В. о. Начальника відділу,37395418,Святошинська районна в місті Києві державна адміністрація,107.1,Апарат Святошинської районної в місті Києві державної адміністрації,UA80000000000093317,Україна,місто Київ,null,null,Київ,просп. Берестейський,97,null,03115,Відділ організації діловодства,doc.srda@kyivcity.gov.ua,+380444243006,"Пн-Чт 08:00-17:00, Пт 08:00-15:45",Перерва на обід: 12:00-12:45
107.1.13,Відділ ведення Державного реєстру виборців,"Ведення реєстру, до якого заносяться відомості про громадян України, які мають право голосу відповідно до статті 70 Конституції України і проживають або перебувають на території Святошинського району міста Києва.",https://media-stg.kyivcity.gov.ua/kyivcity/sites/16/docs/Rosp55_22.pdf,https://svyat.kyivcity.gov.ua/administratsiia/struktura/aparat-raionnoi-v-misti-kyievi-derzhavnoi-administratsii/viddil-vedennia-derzhavnoho-reiestru-vybortsiv,Лада Євгенія Станіславівна,Начальник відділу,37395418,Святошинська районна в місті Києві державна адміністрація,107.1,Апарат Святошинської районної в місті Києві державної адміністрації,UA80000000000093317,Україна,місто Київ,null,null,Київ,вул. Крамського,10,null,03115,Відділ організації діловодства,doc.srda@kyivcity.gov.ua,+380444243006,"Пн-Чт 08:00-17:00, Пт 08:00-15:45",Перерва на обід: 12:00-12:45
107.1.11,Відділ роботи зі зверненнями громадян,"Завданням відділу є забезпечення реалізації конституційного права громадян на звернення до державної адміністрації та на особистий прийом голови, першого заступника голови, заступників голів, керівника апарату державної адміністрації верховенства права, законності, персональної відповідальності, пріоритетності прав людини, оприлюднення, поєднання державних, загальноміських інтересів; сприяння громадянам у вирішенні відповідно до чинного законодавства питань, з якими вони звернулись до голови державної адміністрації, першого заступника голови, заступників голів, керівника апарату державної адміністрації; організація розгляду звернень громадян: пропозицій (зауважень), заяв (клопотань), скарг, у тому числі ведення діловодства та проведення особистого прийому; - здійснення інформаційно-довідкової та аналітичної роботи з питань компетенції відділу, повідомлення громадян про результати розгляду звернень.",https://media-stg.kyivcity.gov.ua/kyivcity/sites/16/docs/rosp568_23.pdf,https://svyat.kyivcity.gov.ua/administratsiia/struktura/aparat-raionnoi-v-misti-kyievi-derzhavnoi-administratsii/viddil-roboty-iz-zvernenniamy-hromadian,Сторожук Віра Леонідівна,Начальник відділу,37395418,Святошинська районна в місті Києві державна адміністрація,107.1,Апарат Святошинської районної в місті Києві державної адміністрації,UA80000000000093317,Україна,місто Київ,null,null,Київ,вул. Львівська,8/6,null,03115,Відділ організації діловодства,zgsrda@kyivcity.gov.ua,+380442990869,"Пн-Чт 08:00-17:00, Пт 08:00-15:45",Перерва на обід: 12:00-12:45
107.1.5,Відділ муніципальної безпеки,"Завданням відділу є забезпечення реалізації та дотримання державної політики у сфері цивільного захисту, у межах законодавства, державної політики у сфері цивільного захисту населення і територій від надзвичайних ситуацій, запобігання і виникненню, реагування на них та ліквідації їх наслідків на території Святошинського району міста Києва; забезпечення реалізації державної політики у сфері захисту критичної інфраструктури та оборонної роботи; забезпечення здійснення завдань та заходів щодо підготовки та ведення національного спротиву, визначених законодавством про оборону України.",https://media-stg.kyivcity.gov.ua/kyivcity/sites/16/docs/rosp570_23.pdf,https://svyat.kyivcity.gov.ua/administratsiia/struktura/aparat-raionnoi-v-misti-kyievi-derzhavnoi-administratsii/viddil-munitsypalnoi-bezpeky,Іщенко Юрій Анатолійович,Начальник відділу,37395418,Святошинська районна в місті Києві державна адміністрація,107.1,Апарат Святошинської районної в місті Києві державної адміністрації,UA80000000000093317,Україна,місто Київ,null,null,Київ,вул. Мирослава Поповича,16,null,03115,Відділ організації діловодства,doc.srda@kyivcity.gov.ua,+380444243006,"Пн-Чт 08:00-17:00, Пт 08:00-15:45",Перерва на обід: 12:00-12:45
107.1.24,Сектор з питань охорони здоров'я,"Організовує виконання Конституції і законів України, актів Президента України, Кабінету Міністрів України, розпоряджень виконавчого органу Київської міської ради (Київської міської державної адміністрації). наказів Департаменту охорони здоров'я виконавчого органу Київської міської ради (Київської міської державної адміністрації), розпоряджень Святошинської районної в місті Києві державної адміністрації та здійснює контроль за їх виконанням.",https://media-stg.kyivcity.gov.ua/kyivcity/sites/16/docs/rosp579_23.pdf,https://svyat.kyivcity.gov.ua/administratsiia/struktura/aparat-raionnoi-v-misti-kyievi-derzhavnoi-administratsii/sektor-z-pytan-okhorony-zdorovia,Кухаренко Дмитро Миколайович,В. о. Начальника сектору,37395418,Святошинська районна в місті Києві державна адміністрація,107.1,Апарат Святошинської районної в місті Києві державної адміністрації,UA80000000000093317,Україна,місто Київ,null,null,Київ,просп. Берестейський,97,null,03115,Відділ організації діловодства,doc.srda@kyivcity.gov.ua,+380444243006,"Пн-Чт 08:00-17:00, Пт 08:00-15:45",Перерва на обід: 12:00-12:45
107.1.2,Організаційний відділ,"Завданням відділу є організаційне, інформаційне забезпечення діяльності Святошинської районної в місті Києві державної адміністрації.",https://media-stg.kyivcity.gov.ua/kyivcity/sites/16/docs/Rosp603_20.pdf,https://svyat.kyivcity.gov.ua/administratsiia/struktura/aparat-raionnoi-v-misti-kyievi-derzhavnoi-administratsii/orhanizatsiinyi-viddil,Гордєєва Валентина Миколаївна,Начальник відділу,37395418,Святошинська районна в місті Києві державна адміністрація,107.1,Апарат Святошинської районної в місті Києві державної адміністрації,UA80000000000093317,Україна,місто Київ,null,null,Київ,просп. Берестейський,97,null,03115,Відділ організації діловодства,doc.srda@kyivcity.gov.ua,+380444243006,"Пн-Чт 08:00-17:00, Пт 08:00-15:45",Перерва на обід: 12:00-12:45
107.1.7,Юридичний відділ,"Завданням відділу є організація правової роботи, спрямованої на правильне застосування, неухильне дотримання та запобігання невиконанню вимог законодавства, інших нормативних актів державною адміністрацією, а також представлення інтересів державної адміністрації,територіальної громади міста Києва в особі Київської міської ради в судах.",https://media-stg.kyivcity.gov.ua/kyivcity/sites/16/docs/Rosp733_20.pdf,https://svyat.kyivcity.gov.ua/administratsiia/struktura/aparat-raionnoi-v-misti-kyievi-derzhavnoi-administratsii/yurydychnyi-viddil,Коновальчук Діна Петрівна,Начальник відділу,37395418,Святошинська районна в місті Києві державна адміністрація,107.1,Апарат Святошинської районної в місті Києві державної адміністрації,UA80000000000093317,Україна,місто Київ,null,null,Київ,просп. Берестейський,97,null,03115,Юридичний відділ,jursrda@kyivcity.gov.ua,+380444240086 +380444242217,"Пн-Чт 08:00-17:00, Пт 08:00-15:45",Перерва на обід: 12:00-12:45
107.1.16,Відділ обліку та розподілу житлової площі,Забезпечення реалізації державної політики у сфері забезпечення громадян житловою площею та надання адміністративних послуг.,https://media-stg.kyivcity.gov.ua/kyivcity/sites/16/docs/Rosp939_19.pdf,https://svyat.kyivcity.gov.ua/administratsiia/struktura/aparat-raionnoi-v-misti-kyievi-derzhavnoi-administratsii/viddil-obliku-ta-rozpodilu-zhytlovoi-ploshchi,Мощенко Галина Петрівна,Начальник відділу,37395418,Святошинська районна в місті Києві державна адміністрація,107.1,Апарат Святошинської районної в місті Києві державної адміністрації,UA80000000000093317,Україна,місто Київ,null,null,Київ,вул. Львівська,8/6,null,03115,Відділ організації діловодства,doc.srda@kyivcity.gov.ua,+380444243006,"Пн-Чт 08:00-17:00, Пт 08:00-15:45",Перерва на обід: 12:00-12:45
107.1.23,Відділ з питань реєстрації місця проживання/перебування фізичних осіб,"Забезпечує реалізацію державної політики у сфері декларування місця проживання, реєстрації місця проживання (перебування) та зняття із задекларованого або зареєстрованого місця проживання (перебування) особи на території Святошинського району міста Києва.",https://media-stg.kyivcity.gov.ua/kyivcity/sites/16/docs/rozp.283_22.pdf,https://svyat.kyivcity.gov.ua/administratsiia/struktura/aparat-raionnoi-v-misti-kyievi-derzhavnoi-administratsii/viddil-z-pytan-reiestratsii-mistsia-prozhyvanniaperebuvannia-fizychnykh-osib,null,Начальник відділу,37395418,Святошинська районна в місті Києві державна адміністрація,107.1,Апарат Святошинської районної в місті Києві державної адміністрації,UA80000000000093317,Україна,місто Київ,null,null,Київ,вул. Львівська,8/6,null,03115,Відділ організації діловодства,doc.srda@kyivcity.gov.ua,+380444243006,"Пн-Чт 08:00-17:00, Пт 08:00-15:45",Перерва на обід: 12:00-12:45
107.1.3,Відділ управління персоналом,Реалізація державної політики з питань управління персоналом в апараті Святошинської районної в місті Києві державної адміністрації.,https://media-stg.kyivcity.gov.ua/kyivcity/sites/16/docs/rozp.405_22.pdf,https://svyat.kyivcity.gov.ua/administratsiia/struktura/aparat-raionnoi-v-misti-kyievi-derzhavnoi-administratsii/viddil-upravlinnia-personalom,Сударікова Ірина Леонідівна,Начальник відділу,37395418,Святошинська районна в місті Києві державна адміністрація,107.1,Апарат Святошинської районної в місті Києві державної адміністрації,UA80000000000093317,Україна,місто Київ,null,null,Київ,просп. Берестейський,97,null,03115,Відділ організації діловодства,doc.srda@kyivcity.gov.ua,+380444243006,"Пн-Чт 08:00-17:00, Пт 08:00-15:45",Перерва на обід: 12:00-12:45
