uid,name,description,constituentDocUrl,homepage,headName,headPost,unitOfId,unitOfName,subUnitOfId,subUnitOfName,CATUTTC,addressAdminUnitL1,addressAdminUnitL2,addressAdminUnitL3,addressAdminUnitL4,addressPostName,addressThoroughfare,addressLocatorDesignator,addressLocatorName,addressPostCode,contactPointName,contactPointEmail,contactPointTelephone,openingHours,availabilityRestriction
102.10,Управління освіти,Забезпечення реалізації державної політики у сфері освіти Деснянського району міста Києва.,https://desn.kyivcity.gov.ua/struktura-viddily/upravlinnia-osvity,https://desn.kyivcity.gov.ua/struktura-viddily/upravlinnia-osvity,Рожкова Людмила Михайлівна,Начальник управління,37415088,Деснянська районна в місті Києві державна адміністрація,102,Дарницька районна в місті Києві державна адміністрація,UA80000000000093317,Україна,місто Київ,null,null,Київ,вул. Миколи Закревського,15-А,null,02225,Приймальня,ruodesn.gov.ua,+380445466780,"Пн-Чт 09:00-16:00, Пт 09:00-15:00",Перерва на обід: 12:00-12:45
102.7,Управління житлово-комунального господарства,Забезпечує реалізацію державної політики у сфері житлово-комунального господарства на території Деснянського району міста Києва.,https://desn.kyivcity.gov.ua/struktura-viddily/upravlinnia-zhytlovo-komunalnoho-hospodarstva,https://desn.kyivcity.gov.ua/struktura-viddily/upravlinnia-zhytlovo-komunalnoho-hospodarstva,Рогатюк Юрій Петрович,Начальник управління,37415088,Деснянська районна в місті Києві державна адміністрація,102,Деснянська районна в місті Києві державна адміністрація,UA80000000000093317,Україна,місто Київ,null,null,Київ,просп. Червоної Калини,29,null,02225,Приймальня,ujkg_desnrda@kyivcity.gov.ua,+380445467658,"Пн-Чт 09:00-16:00, Пт 09:00-15:00",Перерва на обід: 12:00-12:45
102.5,Управління культури,"Основними завданнями Управління є забезпечення реалізації державної політики у сфері культури, туризму, охорони культурної спадщини, державної мовної політики, міжнаціональних відносин, релігії та захисту прав національних меншин на території Деснянського району міста Києва.",https://kyivaudit.gov.ua/vr/ka/company.nsf/(pdpredr)/37501627,https://desn.kyivcity.gov.ua/struktura-viddily/upravlinnia-kultury,Закомірний Ігор Миколайович,Начальник управління,37415088,Деснянська районна в місті Києві державна адміністрація,102,Деснянська районна в місті Києві державна адміністрація,UA80000000000093317,Україна,місто Київ,null,null,Київ,просп. Червоної Калини,29,null,02225,Приймальня,ukul_desnrda@kyivcity.gov.ua,+380445159601,"Пн-Чт 08:00-17:00, Пт 08:00-15:45",Дні та години прийому: Пн 15:00-17:00. Перерва на обід: 12:00-12:45
102.3,Управління благоустрою та підприємництва,"Забезпечення реалізації державної політики у сфері здійснення контролю за благоустроєм, охороною навколишнього природного середовища, розвитку підприємництва та у сфері торгівлі, побутових послуг, а також транспортної інфраструктури на території Деснянського району міста Києва.",https://media-stg.kyivcity.gov.ua/kyivcity/sites/10/2021/4/9/1.pdf,https://desn.kyivcity.gov.ua/,Юрченко Ігор Олегович,Начальник управління,37415088,Деснянська районна в місті Києві державна адміністрація,102,Деснянська районна в місті Києві державна адміністрація,UA80000000000093317,Україна,місто Київ,null,null,Київ,просп. Червоної Калини,29,null,02225,Герасимчук Олександра Олександрівна,ubp_desnrda@kyivcity.gov.ua,+380445461055,"Пн-Чт 08:00-17:00, Пт 08:00-15:45",Перерва на обід: 12:00-12:45
102.11,Служба у справах дітей та сім'ї,"Реалізація державної політики з питань соціального захисту дітей, запобігання дитячій бездоглядності та безпритульності, вчиненню дітьми правопорушень.",https://media-stg.kyivcity.gov.ua/kyivcity/sites/10/2023/4/5/183.pdf,https://desn.kyivcity.gov.ua/struktura-viddily/sluzhba-u-spravakh-ditei-ta-simi,Васільєва Оксана Володимирівна,Начальник служби,37415088,Деснянська районна в місті Києві державна адміністрація,102,Деснянська районна в місті Києві державна адміністрація,UA80000000000093317,Україна,місто Київ,null,null,Київ,просп. Червоної Калини,21-Г,null,02064,Приймальня,ssd_desnrda@kyivcity.gov.ua,+380445157576,"Пн-Чт 09:00-16:00, Пт 09:00-15:00",Перерва на обід: 12:00-12:45
102.6,Управління соціальної та ветеранської політики,"Управління соціальної та ветеранської політики Деснянської районної в місті Києві державної адміністрації - це структурний підрозділ райдержадміністрації (зі статусом юридичної особи публічного права), що реалізує державну соціальну та ветеранську політику.",https://media-stg.kyivcity.gov.ua/kyivcity/sites/10/2024/820.pdf,null,Філоненко Анастасія Володимирівна,Начальник управління,37415088,Деснянська районна в місті Києві державна адміністрація,102,Деснянська районна в місті Києві державна адміністрація,UA80000000000093317,Україна,місто Київ,null,null,Київ,вул. Миколи Закревського,87-Д,null,02064,Приймальня,usvp_desnrda@kyivcity.gov.ua,+380445301616,"Пн-Чт 09:00-16:00, Пт 09:00-15:00",Перерва на обід: 12:00-12:45
102.2,Управління (Центр) надання адміністративних послуг,"Управління (Центр) надання адміністративних послуг Деснянської районної в місті Києві державної адміністрації - це структурний підрозділ райдержадміністрації (юридична особа публічного права), в якому надаються адміністративні послуги через адміністраторів, шляхом їх взаємодії з суб'єктами надання адміністративних послуг. Завданням Управління є надання адміністративних послуг у найкоротший строк та за мінімальної кількості відвідувань суб'єктів звернень; спрощення процедури отримання адміністративних послуг, визначення та вжиття заходів щодо підвищення рівня якості їх надання; забезпечення інформування суб'єктів звернень про вимоги та порядок надання адміністративних послуг, що надаються через адміністратора; забезпечення процесу автоматизації прийому документів та надання адміністративних послуг шляхом використання інформаційних систем та систем електронного документообігу.",https://media-stg.kyivcity.gov.ua/kyivcity/sites/10/uploaded-files/%20%D0%94%D0%B5%D1%81%D0%BD%20%D0%A6%D0%9D%D0%90%D0%9F.pdf,"https://desn.kyivcity.gov.ua/tsnap, https://kyivcnap.gov.ua/",Володіна Наталія Ансибулівна,Начальник управління - адміністратор,37415088,Деснянська районна в місті Києві державна адміністрація,102,Деснянська районна в місті Києві державна адміністрація,UA80000000000093317,Україна,місто Київ,null,null,Київ,просп. Червоної Калини,29,null,02225,Відділ з питань організаційного забезпечення,cnap_desnrda@kmda.gov.ua,+380445469900,Пн-Пт 09:00-18:00,null
103,Дніпровська районна в місті Києві державна адміністрація,"Дніпровська РДА є місцевим органом виконавчої влади і входить до системи органів виконавчої влади. Адміністрація будує свою роботу на засадах верховенства права, законності, персональної відповідальності, пріоритетності прав людини, оприлюднення, поєднання державних, загальноміських інтересів.",https://media-stg.kyivcity.gov.ua/kyivcity/sites/11/uploaded-files/2024/04/25/reglam.pdf,https://dnipr.kyivcity.gov.ua/,Паладій Андрій Миколайович,Голова,null,null,null,null,UA80000000000093317,Україна,місто Київ,null,null,Київ,бульв. Івана Котляревського,1/1,null,02094,Приймальня,rda.dniprovska@kyivcity.gov.ua,+380445732750,"Пн-Чт 08:00-17:00, Пт 08:00-15:45","Оообистий прийом: 1, 3 понеділок місяця з 13.30 до 15.00; перерва на обід: 12:00-12:45"
103.1.23,Сектор з питань охорони праці,Забезпечення реалізації державної політики у сфері охорони праці стосовно пріоритетності життя та здоров'я працівників.,https://media-stg.kyivcity.gov.ua/kyivcity/sites/11/uploaded-files/2024/01/1/001-2020.pdf,https://dnipr.kyivcity.gov.ua/administratsiia/strukturni-pidrozdily/sektor-z-pytan-okhorony-pratsi,Марек Оксана Вікторівна,Завідувач сектору,37203257,Дніпровська районна в місті Києві державна адміністрація,103.1,Апарат Дніпровської районної в місті Києві державної адміністрації,UA80000000000093317,Україна,місто Київ,null,null,Київ,бульв. Івана Котляревського,1/1,null,02094,Марек Оксана Вікторівна,oksana.marek@kyivcity.gov.ua,+380443665140,"Пн-Чт 08:00-17:00, Пт 08:00-15:45",Перерва на обід: 12:00-12:45
103.1.13,Відділ ведення Державного реєстру виборців,Ведення персоніфікованого обліку виборців.,https://media-stg.kyivcity.gov.ua/kyivcity/sites/11/uploaded-files/2024/01/2/143.pdf,https://dnipr.kyivcity.gov.ua/administratsiia/strukturni-pidrozdily/viddil-vedennia-derzhavnoho-reiestru-vybortsiv,Шаміна Людмила Валеріївна,Начальник відділу,37203257,Дніпровська районна в місті Києві державна адміністрація,103.1,Апарат Дніпровської районної в місті Києві державної адміністрації,UA80000000000093317,Україна,місто Київ,null,null,Київ,бульв. Івана Котляревського,1/1,null,02094,Шаміна Людмила Валеріївна,liudmyla.shamina@kyivcity.gov.ua,"+380443665123, +380443665124","Пн-Чт 08:00-17:00, Пт 08:00-15:45",Перерва на обід: 12:00-12:45
103.1.11,Відділ з питань адміністративно-господарського забезпечення та закупівель,"Забезпечення господарського обслуговування і належного стану майна у відповідності з правилами і нормами виробничої санітарії, пожежної безпеки споруд і приміщень.",https://media-stg.kyivcity.gov.ua/kyivcity/sites/11/uploaded-files/2024/01/2/539.pdf,https://dnipr.kyivcity.gov.ua/administratsiia/strukturni-pidrozdily/viddil-z-pytan-administratyvno-hospodarskoho-zabezpechennia-ta-zakupivel,Говорун Сергій Миколайович,Начальник відділу,37203257,Дніпровська районна в місті Києві державна адміністрація,103.1,Апарат Дніпровської районної в місті Києві державної адміністрації,UA80000000000093317,Україна,місто Київ,null,null,Київ,бульв. Івана Котляревського,1/1,null,02094,Говорун Сергій Миколайович,sergii.govozun@kyivcity.gov.ua,+380443665120,"Пн-Чт 08:00-17:00, Пт 08:00-15:45",Перерва на обід: 12:00-12:45
103.1.10,Відділ бухгалтерського обліку і звітності,"Забезпечення бухгалтерського обліку і звітності, виконання кошторису видатків райдержадміністрації.",https://media-stg.kyivcity.gov.ua/kyivcity/sites/11/uploaded-files/2024/01/2/buhgalter.pdf,https://dnipr.kyivcity.gov.ua/administratsiia/strukturni-pidrozdily/viddil-bukhhalterskoho-obliku-i-zvitnosti,Осінська Лариса Василівна,Начальник відділу,37203257,Дніпровська районна в місті Києві державна адміністрація,103.1,Апарат Дніпровської районної в місті Києві державної адміністрації,UA80000000000093317,Україна,місто Київ,null,null,Київ,бульв. Івана Котляревського,1/1,null,02094,Осінська Лариса Василівна,larysa.osinska@kyivcity.gov.ua,"+380443665119, +380443665117, +380443665118","Пн-Чт 08:00-17:00, Пт 08:00-15:45",Перерва на обід: 12:00-12:45
103.1.14,Відділ інформаційних технологій,Організація впровадження розвитку електронного урядування та захисту інформації в апараті Дніпровської районної в місті Києві державної адміністрації.,https://media-stg.kyivcity.gov.ua/kyivcity/sites/11/uploaded-files/2024/01/2/it.pdf,https://dnipr.kyivcity.gov.ua/administratsiia/strukturni-pidrozdily/viddil-informatsiinykh-tekhnolohii,Крижанівський Віталій Миколайович,Начальник відділу,37203257,Дніпровська районна в місті Києві державна адміністрація,103.1,Апарат Дніпровської районної в місті Києві державної адміністрації,UA80000000000093317,Україна,місто Київ,null,null,Київ,бульв. Івана Котляревського,1/1,null,02094,Крижанівський Віталій Миколайович,vitalii.kryzhanivsky@kyivcity.gov.ua,+380443665126,"Пн-Чт 08:00-17:00, Пт 08:00-15:45",Перерва на обід: 12:00-12:45
103.1.8,Відділ контролю,"Веде в установленому порядку облік завдань, реалізація яких передбачена відповідними документами, та роботи з реагування на запити і звернення народних депутатів України та депутатів місцевих рад, контроль за якими покладено на відділ.",https://media-stg.kyivcity.gov.ua/kyivcity/sites/11/uploaded-files/2024/01/2/ontrol.pdf,https://dnipr.kyivcity.gov.ua/administratsiia/strukturni-pidrozdily/viddil-kontroliu,Жовнірчик Людмила Василівна,Начальник відділу,37203257,Дніпровська районна в місті Києві державна адміністрація,103.1,Апарат Дніпровської районної в місті Києві державної адміністрації,UA80000000000093317,Україна,місто Київ,null,null,Київ,бульв. Івана Котляревського,1/1,null,02094,Жовнірчик Людмила Василівна,liudmyla.zhovnirchyk@kyivcity.gov.ua,+380443665114,"Пн-Чт 08:00-17:00, Пт 08:00-15:45",Перерва на обід: 12:00-12:45
103.1.16,Відділ з питань інформаційної політики,"Об'єктивне та всебічне висвітлення діяльності райдержадміністрації у мережі Інтернет, ЗМІ, підготовка й поширення інформаційних матеріалів, прес-релізів тощо.",https://media-stg.kyivcity.gov.ua/kyivcity/sites/11/uploaded-files/2024/01/2/poloqennya.pdf,https://dnipr.kyivcity.gov.ua/administratsiia/strukturni-pidrozdily/viddil-z-pytan-informatsiinoi-polityky,Бондар Сергій Олександрович,Начальник відділу,37203257,Дніпровська районна в місті Києві державна адміністрація,103.1,Апарат Дніпровської районної в місті Києві державної адміністрації,UA80000000000093317,Україна,місто Київ,null,null,Київ,бульв. Івана Котляревського,1/1,null,02094,Бондар Сергій Олександрович,sergii.bondar@kyivcity.gov.ua,+380443665129,"Пн-Чт 08:00-17:00, Пт 08:00-15:45",Перерва на обід: 12:00-12:45
103.1.27,Відділ моніторингу звернень,"Забезпечує реалізацію конституційного права громадян на звернення до органів державної влади, посадових осіб цих органів щодо захисту їх законних прав та інтересів.",https://media-stg.kyivcity.gov.ua/kyivcity/sites/11/uploaded-files/2024/01/2/Viddil_monitoringu_zvernen.pdf,https://dnipr.kyivcity.gov.ua/administratsiia/strukturni-pidrozdily/viddil-monitorynhu-zvernen,Мошковська Тетяна Миколаївна,в.о. начальника відділу,37203257,Дніпровська районна в місті Києві державна адміністрація,103.1,Апарат Дніпровської районної в місті Києві державної адміністрації,UA80000000000093317,Україна,місто Київ,null,null,Київ,бульв. Івана Котляревського,1/1,null,02094,Мошковська Тетяна Миколаївна,tatiana.moshkovska@kyivcity.gov.ua,"+380443665115, +380443665116","Пн-Чт 08:00-17:00, Пт 08:00-15:45",Перерва на обід: 12:00-12:45
103.1.25,"Відділ з питань державної реєстрації юридичних осіб, фізичних осіб-підприємців","Засвідчення факту створення та /або припинення юридичної особи, засвідчення факту на буття та/або позбавлення статусу підприємця фізичною особою, а також вчинення інших реєстраційних дій, які передбачені Законом України «Про державну реєстрацію юридичних осіб, фізичних осіб-підприємців та громадських формувань, шляхом внесення відповідних записів до Єдиного державного реєстру юридичних осіб, фізичних осіб-підприємців та громадських формувань».",https://media-stg.kyivcity.gov.ua/kyivcity/sites/11/uploaded-files/2024/01/3/277.pdf,https://dnipr.kyivcity.gov.ua/administratsiia/strukturni-pidrozdily/viddil-z-pytan-derzhavnoi-reiestratsii-iurydychnykh-osib-fizychnykh-osib-pidpryiemtsiv,Карпенко Євген Сергійович,Начальник відділу,37203257,Дніпровська районна в місті Києві державна адміністрація,103.1,Апарат Дніпровської районної в місті Києві державної адміністрації,UA80000000000093317,Україна,місто Київ,null,null,Київ,бульв. Івана Котляревського,1/1,null,02094,Карпенко Євген Сергійович,yevgen.karpenko@kyivcity.gov.ua,+380443665152,"Пн-Чт 08:00-17:00, Пт 08:00-15:45",Перерва на обід: 12:00-12:45
103.1.3,"Відділ оборонної роботи, мобілізаційної підготовки та мобілізації","Вирішення питань оборонної, мобілізаційної роботи.",https://media-stg.kyivcity.gov.ua/kyivcity/sites/11/uploaded-files/2024/01/3/mobilisas.pdf,https://dnipr.kyivcity.gov.ua/administratsiia/strukturni-pidrozdily/sektor-z-pytan-mobilizatsiinoi-roboty,Романов Олег Владиславович,В.о. начальника відділу,37203257,Дніпровська районна в місті Києві державна адміністрація,103.1,Апарат Дніпровської районної в місті Києві державної адміністрації,UA80000000000093317,Україна,місто Київ,null,null,Київ,бульв. Івана Котляревського,1/1,null,02094,Романов Олег Владиславович,oleh.romanov@kyivcity.gov.ua,+380443665148,"Пн-Чт 08:00-17:00, Пт 08:00-15:45",Перерва на обід: 12:00-12:45
103.1.30,Сектор з питань праці та соціально-трудових відносин,"Забезпечення реалізації державної політики у сфері соціально-трудових відносин, оплати праці та зайнятості населення на території Дніпровського району м. Києва.",https://media-stg.kyivcity.gov.ua/kyivcity/sites/11/uploaded-files/2024/01/3/sec.pdf,https://dnipr.kyivcity.gov.ua/administratsiia/strukturni-pidrozdily/sektor-z-pytan-pratsi-ta-sotsialno-trudovykh-vidnosyn,Столяр Світлана Олександрівна,Завідувач сектору,37203257,Дніпровська районна в місті Києві державна адміністрація,103.1,Апарат Дніпровської районної в місті Києві державної адміністрації,UA80000000000093317,Україна,місто Київ,null,null,Київ,бульв. Івана Котляревського,1/1,null,02094,Столяр Світлана Олександрівна,svitlana.stoliar@kyivcity.gov.ua,+380443665108,"Пн-Чт 08:00-17:00, Пт 08:00-15:45",Перерва на обід: 12:00-12:45
