uid,name,description,constituentDocUrl,homepage,headName,headPost,unitOfId,unitOfName,subUnitOfId,subUnitOfName,CATUTTC,addressAdminUnitL1,addressAdminUnitL2,addressAdminUnitL3,addressAdminUnitL4,addressPostName,addressThoroughfare,addressLocatorDesignator,addressLocatorName,addressPostCode,contactPointName,contactPointEmail,contactPointTelephone,openingHours,availabilityRestriction
105.1.22,Сектор з питань запобігання та виявлення корупції,Основні завдання сектору: Головним завданням сектору є забезпечення реалізації державної антикорупційної державної політики.,https://minio.kyivcity.gov.ua/kyivcity/sites/14/2025/05.2025/63-%D0%BA.pdf,https://pechersk.kyivcity.gov.ua/administratsiia/struktura/aparat-raionnoi-v-misti-kyievi-derzhavnoi-administratsii/sektor-z-pytan-zapobihannia-ta-vyiavlennia-koruptsii,Плєшка Тетяна Олексіївна,Т.в.о. Завідувач сектору,37401206,Печерська районна в місті Києві державна адміністрація,105.1,Апарат Печерської районної в місті Києві державної адміністрації,UA80000000000093317,Україна,місто Київ,null,null,Київ,вул. Михайла Омеляновича-Павленка,15,null,01010,Плєшка Тетяна Олексіївна,anticorruption_pechrda@kyivcity.gov.ua,+380442804080,"Пн-Чт 08:00-17:00, Пт 08:00-15:45",Перерва на обід: 12:00-12:45
105.1.15,"Відділ з питань державної реєстрації юридичних осіб, фізичних осіб-підприємців","Основним завданням відділу є: Забезпечення реалізації державної політики у сфері державної реєстрації юридичних осіб, фізичних осіб – підприємців. Здійснення повноважень, передбачених Законом України «Про державну реєстрацію юридичних осіб, фізичних осіб – підприємців та громадських формувань».",https://media-stg.kyivcity.gov.ua/kyivcity/sites/14/aparat/183-k_vid_reectr_pidpr.pdf,https://pechersk.kyivcity.gov.ua/administratsiia/struktura/aparat-raionnoi-v-misti-kyievi-derzhavnoi-administratsii/viddil-z-pytan-derzhavnoi-reiestratsii-iurydychnykh-osib-fizychnykh-osib-pidpryiemtsiv,Демешко Вікторія Вікторівна,Начальник відділу,37401206,Печерська районна в місті Києві державна адміністрація,105.1,Апарат Печерської районної в місті Києві державної адміністрації,UA80000000000093317,Україна,місто Київ,null,null,Київ,вул. Михайла Омеляновича-Павленка,19,null,01010,Демешко Вікторія Вікторівна,vdr_pechrda@kyivcity.gov.ua,+380442800725,"Пн-Чт 08:00-17:00, Пт 08:00-15:45",Перерва на обід: 12:00-12:45
105.4,Управління соціальної та ветеранської політики,Основним завданням управління є забезпечення реалізації державної соціальної політики на відповідній території у сфері соціального захисту населення.,https://media-stg.kyivcity.gov.ua/kyivcity/sites/14/aparat/421.pdf,https://pechersk.kyivcity.gov.ua/administratsiia/struktura/strukturni-pidrozdily-raionnoi-v-misti-kyievi-derzhavnoi-administratsii-z-pravom-iurydychnoi-osoby/upravlinnia-sotsialnoho-zakhystu-naselennia,Мозгова Ольга Вікторівна,Начальник управління,37401206,Печерська районна в місті Києві державна адміністрація,105,Печерська районна в місті Києві державна адміністрація,UA80000000000093317,Україна,місто Київ,null,null,Київ,вул. Цитадельна,4/7,null,01015,Мозгова Ольга Вікторівна,upszn_pechrda@kyivcity.gov.ua,+380442544269,"Пн-Чт 08:00-17:00, Пт 08:00-15:45",Перерва на обід: 12:00-12:45
105.1.17,Відділ благоустрою та екології,Основними завданнями відділу з питань благоустрою та екології є: забезпечення реалізації державної політики у сфері благоустрою на території Печерського району.,https://media-stg.kyivcity.gov.ua/kyivcity/sites/14/aparat/425.pdf,https://pechersk.kyivcity.gov.ua/administratsiia/struktura/aparat-raionnoi-v-misti-kyievi-derzhavnoi-administratsii/viddil-kontroliu-za-blahoustroiem,Султанов Вадим Олександрович,Начальник відділу,37401206,Печерська районна в місті Києві державна адміністрація,105.1,Апарат Печерської районної в місті Києві державної адміністрації,UA80000000000093317,Україна,місто Київ,null,null,Київ,вул. Князів Острозьких,37/2,null,01010,Султанов Вадим Олександрович,vkb_pechrda@kyivcity.gov.ua,+380442885001,"Пн-Чт 08:00-17:00, Пт 08:00-15:45",Перерва на обід: 12:00-12:45
105.1.16,"Відділ торгівлі, споживчого ринку та підприємництва","Основні завдання відділу: Забезпечення реалізації державної політики у сфері внутрішньої торгівлі, побутового обслуговування населення. Залучення на споживчий ринок товарних ресурсів міста Києва, інших регіонів України для забезпечення мешканців району необхідними товарами. Взаємодія з відповідними органами влади у сфері захисту прав споживачів.",https://media-stg.kyivcity.gov.ua/kyivcity/sites/14/aparat/59-k_p_torgivlya.pdf,https://pechersk.kyivcity.gov.ua/administratsiia/struktura/aparat-raionnoi-v-misti-kyievi-derzhavnoi-administratsii/viddil-torhivli-spozhyvchoho-rynku-ta-pidpryiemnytstva,Науменко Наталія Леонідівна,Начальник відділу,37401206,Печерська районна в місті Києві державна адміністрація,105.1,Апарат Печерської районної в місті Києві державної адміністрації,UA80000000000093317,Україна,місто Київ,null,null,Київ,вул. Михайла Омеляновича-Павленка,15,null,01010,Науменко Наталія Леонідівна,torg_pechrda@kyivcity.gov.ua,+380442802385,"Пн-Чт 08:00-17:00, Пт 08:00-15:45",Перерва на обід: 12:00-12:45
105.1.7,Відділ бухгалтерського обліку та звітності,Основним завданням відділу є: ведення бухгалтерського обліку фінансово-господарської діяльності райдержадміністрації та складання звітності.,https://media-stg.kyivcity.gov.ua/kyivcity/sites/14/aparat/612_k_buxg_p.pdf,https://pechersk.kyivcity.gov.ua/administratsiia/struktura/aparat-raionnoi-v-misti-kyievi-derzhavnoi-administratsii/viddil-bukhhalterskoho-obliku-ta-zvitnosti,Черняєва Світлана Анатоліївна,Начальник відділу,37401206,Печерська районна в місті Києві державна адміністрація,105.1,Апарат Печерської районної в місті Києві державної адміністрації,UA80000000000093317,Україна,місто Київ,null,null,Київ,вул. Михайла Омеляновича-Павленка,15,null,01010,Черняєва Світлана Анатоліївна,buh_pechrda@kyivcity.gov.ua,+380442801447,"Пн-Чт 08:00-17:00, Пт 08:00-15:45",Перерва на обід: 12:00-12:45
105.1.5,Відділ організації діловодства,"Основним завданням відділу є: здійснює ведення діловодства відповідно Інструкції з діловодства, затвердженої розпорядженням виконавчого органу Київської міської ради (Київської міської державної адміністрації) від 25 вересня 2018 року № 1747 «Про затвердження Інструкції з діловодства у виконавчому органі Київської міської ради (Київської міської державної адміністрації) ), районних в місті Києві державних адміністраціях»адміністрації в судах.",https://media-stg.kyivcity.gov.ua/kyivcity/sites/14/aparat/dilov_615-k.pdf,https://pechersk.kyivcity.gov.ua/administratsiia/struktura/aparat-raionnoi-v-misti-kyievi-derzhavnoi-administratsii/viddil-orhanizatsii-dilovodstva,Пшенична Тамара Володимирівна,Начальник відділу,37401206,Печерська районна в місті Києві державна адміністрація,105.1,Апарат Печерської районної в місті Києві державної адміністрації,UA80000000000093317,Україна,місто Київ,null,null,Київ,вул. Михайла Омеляновича-Павленка,15,null,01010,Пшенична Тамара Володимирівна,rda.pecherska@kyivcity.gov.ua,+380442886372,"Пн-Чт 08:00-17:00, Пт 08:00-15:45",Перерва на обід: 12:00-12:45
105.1.14,Відділ з питань реєстрації місця проживання/перебування фізичних осіб,"Основними завданнями відділу є: формування та ведення Реєстру територіальної громади місті Києва у межах відповідної адміністративно-територіальної одиниці; декларування та реєстрація, зняття з реєстрації місця проживання/перебування осіб у межах відповідної адміністративно-територіальної одиниці.",https://media-stg.kyivcity.gov.ua/kyivcity/sites/14/aparat/pologenia_misce_projuv_71-k.pdf,https://pechersk.kyivcity.gov.ua/administratsiia/struktura/aparat-raionnoi-v-misti-kyievi-derzhavnoi-administratsii/viddil-z-pytan-reiestratsii-mistsia-prozhyvanniaperebuvannia-fizychnykh-osib,Модлінська Олена Євгенівна,Начальник відділу,37401206,Печерська районна в місті Києві державна адміністрація,105.1,Апарат Печерської районної в місті Києві державної адміністрації,UA80000000000093317,Україна,місто Київ,null,null,Київ,вул. Михайла Омеляновича-Павленка,15,null,01010,Модлінська Олена Євгенівна,rmp_pechrda@kyivcity.gov.ua,+380442801576,"Пн-Чт 08:00-17:00, Пт 08:00-15:45",Перерва на обід: 12:00-12:45
105.1.10,Відділ інформаційних технологій,"Основним завданням відділу є: технічна підтримка працездатності засобів обчислювальної техніки для забезпечення діяльності районної державної адміністрації, а також контроль за впровадженням та використанням систем технічного захисту конфіденційної інформації з обмеженим доступом, що є власністю держави.",https://minio.kyivcity.gov.ua/kyivcity/sites/14/aparat/poloj_inform_vid_3-k.pdf,https://pechersk.kyivcity.gov.ua/administratsiia/struktura/aparat-raionnoi-v-misti-kyievi-derzhavnoi-administratsii/viddil-informatsiinykh-tekhnolohii,Нестеренко Олексій Серггійович,Начальник відділу,37401206,Печерська районна в місті Києві державна адміністрація,105.1,Апарат Печерської районної в місті Києві державної адміністрації,UA80000000000093317,Україна,місто Київ,null,null,Київ,вул. Михайла Омеляновича-Павленка,15,null,01010,Нестеренко Олексій Серггійович,it_pechrda@kyivcity.gov.ua,+380442888757,"Пн-Чт 08:00-17:00, Пт 08:00-15:45",Перерва на обід: 12:00-12:45
105.1.8,Відділ адміністративно-господарського забезпечення,Основним завданням відділу є: здійснення матеріально технічного і господарсько-побутового забезпечення діяльності районної державної адміністрації.,https://media-stg.kyivcity.gov.ua/kyivcity/sites/14/aparat/vagz_77-k_p.pdf,https://pechersk.kyivcity.gov.ua/administratsiia/struktura/aparat-raionnoi-v-misti-kyievi-derzhavnoi-administratsii/viddil-administratyvno-hospodarskoho-zabezpechennia,Сучков Деніс Сергійович,Начальник відділу,37401206,Печерська районна в місті Києві державна адміністрація,105.1,Апарат Печерської районної в місті Києві державної адміністрації,UA80000000000093317,Україна,місто Київ,null,null,Київ,вул. Михайла Омеляновича-Павленка,15,null,01010,Сучков Деніс Сергійович,vagz_pechrda@kyivcity.gov.ua,+380442807018,"Пн-Чт 08:00-17:00, Пт 08:00-15:45",Перерва на обід: 12:00-12:45
105.1.13,Відділ економіки,Основними завданнями відділу є забезпечення реалізації на території Печерського району: державної політики економічного і соціального розвитку; державної регіональної політики; державної політики у сфері розвитку економічної конкуренції та обмеження монополізму; державної політики у сфері інвестиційної діяльності та державно-приватного партнерства.,https://media-stg.kyivcity.gov.ua/kyivcity/sites/14/aparat/vid_ekonomuku_69-k.pdf,https://pechersk.kyivcity.gov.ua/administratsiia/struktura/aparat-raionnoi-v-misti-kyievi-derzhavnoi-administratsii/viddil-ekonomiky,Савенкова Ольга Валеріївна,Начальник відділу,37401206,Печерська районна в місті Києві державна адміністрація,105.1,Апарат Печерської районної в місті Києві державної адміністрації,UA80000000000093317,Україна,місто Київ,null,null,Київ,вул. Михайла Омеляновича-Павленка,15,null,01010,Савенкова Ольга Валеріївна,ekonomika_pechrda@kyivcity.gov.ua,+380442804044,"Пн-Чт 08:00-17:00, Пт 08:00-15:45",Перерва на обід: 12:00-12:45
105.1.1,Відділ управління персоналом,"Основним завданням відділу є: Реалізація державної політики у сфері державної служби, з питань роботи з персоналом в райдержадміністрації; Добір персоналу райдержадміністрації; Розвиток персоналу та організація підвищення рівня професійної компетентності працівників райдержадміністрації; Здійснення аналітичної та організаційної роботи з кадрового менеджменту; Організаційне-методичне керівництво з питань роботи з персоналом у структурних підрозділах райдержадміністрації та державних підприємств, установ і організаціях, що належать до сфери управління райдержадміністрації; Документальне оформлення вступу на державну службу, її проходження та припинення.",https://minio.kyivcity.gov.ua/kyivcity/sites/14/aparat/vup_r.pdf,https://pechersk.kyivcity.gov.ua/administratsiia/struktura/aparat-raionnoi-v-misti-kyievi-derzhavnoi-administratsii/viddil-upravlinnia-personalom,Синяк Любов Володимирівна,Начальник відділу,37401206,Печерська районна в місті Києві державна адміністрація,105.1,Апарат Печерської районної в місті Києві державної адміністрації,UA80000000000093317,Україна,місто Київ,null,null,Київ,вул. Михайла Омеляновича-Павленка,15,null,01010,Синяк Любов Володимирівна,vup_pechrda@kyivcity.gov.ua,+380442807497,"Пн-Чт 08:00-17:00, Пт 08:00-15:45",Перерва на обід: 12:00-12:45
105.1.9,Відділ роботи із зверненнями громадян,"Основним завданням відділу є: Забезпечення кваліфікованого, об'єктивного і своєчасного розгляду заяв, пропозицій і скарг громадян в адміністрації, та її структурних підрозділах.",https://media-stg.kyivcity.gov.ua/kyivcity/sites/14/dokumentu/151_k_zver_grom_p.pdf,https://pechersk.kyivcity.gov.ua/administratsiia/struktura/aparat-raionnoi-v-misti-kyievi-derzhavnoi-administratsii/viddil-roboty-iz-zvernenniamy-hromadian,Лучкіна Оксана Миколаївна,Начальник відділу,37401206,Печерська районна в місті Києві державна адміністрація,105.1,Апарат Печерської районної в місті Києві державної адміністрації,UA80000000000093317,Україна,місто Київ,null,null,Київ,вул. Михайла Омеляновича-Павленка,15,null,01010,Лучкіна Оксана Миколаївна,zvern_pechrda@kyivcity.gov.ua,+380442803585,"Пн-Чт 08:00-17:00, Пт 08:00-15:45",Перерва на обід: 12:00-12:45
105.1.4,Юридичний відділ,"Основним завданням відділу є: організовує та бере участь у забезпеченні реалізації державної правової політики у відповідній сфері, правильного застосування законодавства, у представленні інтересів Печерської районної в місті Києві державної адміністрації в судах.",https://media-stg.kyivcity.gov.ua/kyivcity/sites/14/dokumentu/170-%D0%BA.pdf,https://pechersk.kyivcity.gov.ua/administratsiia/struktura/aparat-raionnoi-v-misti-kyievi-derzhavnoi-administratsii/yurydychnyi-viddil,Щепетова Ірина Геннадіївна,Начальник відділу,37401206,Печерська районна в місті Києві державна адміністрація,105.1,Апарат Печерської районної в місті Києві державної адміністрації,UA80000000000093317,Україна,місто Київ,null,null,Київ,вул. Михайла Омеляновича-Павленка,15,null,01010,Щепетова Ірина Геннадіївна,jurist_pechrda@kyivcity.gov.ua,+380442803672,"Пн-Чт 08:00-17:00, Пт 08:00-15:45",Перерва на обід: 12:00-12:45
105.1.21,"Відділ оборонної роботи, мобілізаційної підготовки та мобілізації",Основні завдання сектору: Організація розробки і здійснення заходів мобілізаційної підготовки та мобілізації і контроль за їх здійсненням на території району в мирний і воєнний час.,https://media-stg.kyivcity.gov.ua/kyivcity/sites/14/dokumentu/420.pdf,https://pechersk.kyivcity.gov.ua/administratsiia/struktura/aparat-raionnoi-v-misti-kyievi-derzhavnoi-administratsii/sektor-z-pytan-mobilizatsiinoi-roboty,Герасименко Григорій Григорович,В.о. начальника відділу,37401206,Печерська районна в місті Києві державна адміністрація,105.1,Апарат Печерської районної в місті Києві державної адміністрації,UA80000000000093317,Україна,місто Київ,null,null,Київ,вул. Михайла Омеляновича-Павленка,15,null,01010,Герасименко Григорій Григорович,mob_pechrda@kyivcity.gov.ua,+380442800324,"Пн-Чт 08:00-17:00, Пт 08:00-15:45",Перерва на обід: 12:00-12:45
105.1.26,Головний спеціаліст внутрішнього аудиту,"Основні завдання та обов'язки головного спеціаліста: Надає незалежні висновки та рекомендації за результатами здійснення контролю за ефективністю діяльності та дотриманням законодавства структурними підрозділами Печерської районної в місті Києві державної адміністрації, що є розпорядниками бюджетних коштів, підприємствами, установами, організаціями комунальної форми власності, що підпорядковані Печерській районній в місті Києві державній адміністрації та її структурним підрозділам, іншими суб'єктами в частині використання ними відповідних комунальних ресурсів (майна, коштів та іншої комунальної власності), а також суб'єктами господарювання, що отримують бюджетне фінансування (далі - підконтрольні суб'єкти).",https://media-stg.kyivcity.gov.ua/kyivcity/sites/14/dokumentu/Posadova_audit.pdf,https://pechersk.kyivcity.gov.ua/administratsiia/struktura/aparat-raionnoi-v-misti-kyievi-derzhavnoi-administratsii/holovnyi-spetsialist-vnutrishnoho-audytu,Попова Олена Олександрівна,Головний спеціаліст внутрішнього аудиту,37401206,Печерська районна в місті Києві державна адміністрація,105.1,Апарат Печерської районної в місті Києві державної адміністрації,UA80000000000093317,Україна,місто Київ,null,null,Київ,вул. Михайла Омеляновича-Павленка,15,null,01010,Попова Олена Олександрівна,vnaudit_pechrda@kyivcity.gov.ua,+380442804080,"Пн-Чт 08:00-17:00, Пт 08:00-15:45",Перерва на обід: 12:00-12:45
